,Unnamed: 0,id,created_at,text,source,tweet_type,source_tweet_id,retweeted_tweet_id,quoted_tweet_id,quote_count,retweet_count,favorite_count,hashtags,most_unrolled_urls,tweet_links,user_screen_name,user_id,user_mentions,user_followers_count,user_following_count,user_listed_count,user_created_at,user_favourites_count,user_verified,user_statuses_count,expanded_links,url_title,url_description,url_domain,clean_text
53,559,244908222027288577,2012-09-09 21:20:44,Michael Savage: How Obama fixed 2012 election: http://t.co/UpLFHN6o via @youtube WHY BHO IS CONFIDENT HE WILL WIN-SOROS COUNTS VOTES #TCOT,web,tweet,244908222027288577,,,0,0,0,TCOT,http://youtu.be/dmJtaOO2etc,http://youtu.be/dmJtaOO2etc,PrezHussain,246474974,10228272,525,1417,16,Wed Feb 02 21:18:54 +0000 2011,0,False,7145,https://www.youtube.com/watch?v=dmJtaOO2etc&feature=youtu.be,michael savage: how obama fixed 2012 election - youtube,michael savage: why obama is confidend of election outcome? obama ensured his re-election aired 4/4/2012,www.youtube.com,michael savage howobamafixed2012 election via youtube bho confident win sorts counts votes cot michael savage howobamafixed2012 election youtube michael savage obama config end election outcome obama ensured reelection aired442012
54,575,244908244403900416,2012-09-09 21:20:50,RT @d_seaman: Also scary: Fox19 anchor Ben Swann asked Obama about his secret kill list which includes US citizens- http://t.co/dFLMsaUF,"<a href=""http://twitter.com/download/android"" rel=""nofollow"">Twitter for Android</a>",retweet,244899914969120768,2.448999149691208e+17,,0,21,0,,http://www.youtube.com/watch?v=Q6QPvk5cgx8|http://www.youtube.com/watch?v=Q6QPvk5cgx8,http://www.youtube.com/watch?v=Q6QPvk5cgx8,mindnovelty,244146542,438829074,1624,1735,44,Fri Jan 28 16:31:56 +0000 2011,0,False,2910,https://www.youtube.com/watch?v=Q6QPvk5cgx8,reality check pres obama 1-on-1: how does he justify having a kill list? - youtube,click to tweet: http://clicktotweetcom/u38fu president barack obama spent his labor day in toledo ohio as part of this visit to the buckeye state ben was,www.youtube.com,rtdseamanalsoscaryfox19 anchor ben swan asked obama secret kill list includes us citizens reality check presobama1on1 justify kill list youtube click tweet president barack obama spent labor day toledo ohio part visit bucket state ben
55,601,244908282744025088,2012-09-09 21:20:59,RT @Alarrowe: @CNN Virginia Tech is serious about getting President Obama on campus. Check out the video http://t.co/10V858Dr  #Obama2V ...,web,retweet,244880906052063232,2.4488090605206323e+17,,0,1,0,Obama2VT|wrvt,http://www.youtube.com/watch?v=w8DNR-rWKyE|http://www.youtube.com/watch?v=w8DNR-rWKyE,http://www.youtube.com/watch?v=w8DNR-rWKyE,Airr_N,338097832,45726971|759251,227,107,1,Tue Jul 19 02:34:35 +0000 2011,0,False,5174,https://www.youtube.com/watch?v=w8DNR-rWKyE,john boyer & his world regions class at virginia tech request president barack obama to visit - youtube,professor john boyer and his 3000 person world regions class at virginia tech request president barack obama to come to his class and discuss american foreig,www.youtube.com,rt al arrow cnn virginia tech serious getting president obama campus check video obama2vjohnboyerhis world regions class virginia tech request president barack obama visit youtube professor john boxer three thousand person world regions class virginia tech request president barack obama come class discuss american big
56,616,244908305221316609,2012-09-09 21:21:04,RT @marabout40: Pizza Shop Owner Gives President A Big Hug http://t.co/qR8UdWwx WTH is Joe doing?? LOL Look at the guys faces LMBO,"<a href=""http://mobile.twitter.com"" rel=""nofollow"">Mobile Web</a>",retweet,244906240948465664,2.4490624094846566e+17,,0,2,0,,http://www.buzzfeed.com/andrewkaczynski/air-obama-pizza-shop-owner-gives-president-a-big|http://www.buzzfeed.com/andrewkaczynski/air-obama-pizza-shop-owner-gives-president-a-big,http://www.buzzfeed.com/andrewkaczynski/air-obama-pizza-shop-owner-gives-president-a-big,dihoppy,22822556,37048835,637,996,13,Wed Mar 04 19:44:33 +0000 2009,0,False,26456,https://www.buzzfeednews.com/article/andrewkaczynski/air-obama-pizza-shop-owner-gives-president-a-big,pizza shop owner gives president a big hug,scott van duzer owner of the big apple pizza showed his affection for the president today in florida,www.buzzfeednews.com,rtmarabout40 pizza shop owner gives president big hug w joe lol look guys faces lb pizza shop owner gives president big hug scott van user owner big apple pizza showed affection president today florida
57,618,244908307968581632,2012-09-09 21:21:05,RT @d_seaman: Also scary: Fox19 anchor Ben Swann asked Obama about his secret kill list which includes US citizens- http://t.co/dFLMsaUF,"<a href=""http://twitter.com/download/iphone"" rel=""nofollow"">Twitter for iPhone</a>",retweet,244899914969120768,2.448999149691208e+17,,0,22,0,,http://www.youtube.com/watch?v=Q6QPvk5cgx8|http://www.youtube.com/watch?v=Q6QPvk5cgx8,http://www.youtube.com/watch?v=Q6QPvk5cgx8,WorleyMark,104306253,438829074,139,507,4,Tue Jan 12 23:27:06 +0000 2010,0,False,928,https://www.youtube.com/watch?v=Q6QPvk5cgx8,reality check pres obama 1-on-1: how does he justify having a kill list? - youtube,click to tweet: http://clicktotweetcom/u38fu president barack obama spent his labor day in toledo ohio as part of this visit to the buckeye state ben was,www.youtube.com,rtdseamanalsoscaryfox19 anchor ben swan asked obama secret kill list includes us citizens reality check presobama1on1 justify kill list youtube click tweet president barack obama spent labor day toledo ohio part visit bucket state ben
58,678,244908376893575168,2012-09-09 21:21:21,RT @sugarscape: Demi Lovato spat on Simon Cowell during X Factor USA audition. LOVELY. http://t.co/rX7LgDbk,"<a href=""http://twitter.com/download/iphone"" rel=""nofollow"">Twitter for iPhone</a>",retweet,244907173216407553,2.4490717321640755e+17,,0,18,0,,http://on.sugarsca.pe/TEkoDJ|http://on.sugarsca.pe/TEkoDJ,http://on.sugarsca.pe/TEkoDJ,PayneInMyPenis,603338030,16510838,59,156,0,Sat Jun 09 05:31:48 +0000 2012,0,False,103,https://www.cosmopolitan.com/uk/,cosmopolitan uk the womens magazine for fashion beauty sex tips and celebrity news,,www.cosmopolitan.com,rt sugars cape demi lovato spat simon powell factor usa audition lovely cosmopolitan uk womens magazine fashion beauty sex tips celebrity news
59,686,244908385554812929,2012-09-09 21:21:23,RT @sugarscape: Demi Lovato spat on Simon Cowell during X Factor USA audition. LOVELY. http://t.co/rX7LgDbk,"<a href=""http://twitter.com/download/iphone"" rel=""nofollow"">Twitter for iPhone</a>",retweet,244907173216407553,2.4490717321640755e+17,,0,19,0,,http://on.sugarsca.pe/TEkoDJ|http://on.sugarsca.pe/TEkoDJ,http://on.sugarsca.pe/TEkoDJ,rachellecast1,340721322,16510838,144,642,0,Sat Jul 23 04:37:34 +0000 2011,0,False,2925,https://www.cosmopolitan.com/uk/,cosmopolitan uk the womens magazine for fashion beauty sex tips and celebrity news,,www.cosmopolitan.com,rt sugars cape demi lovato spat simon powell factor usa audition lovely cosmopolitan uk womens magazine fashion beauty sex tips celebrity news
60,695,244908400989847554,2012-09-09 21:21:27,RT @csread61: Its awesome @BarackObama - GO John Boyer &amp his World Regions class at Virginia Tech request President ...: http://t. ...,"<a href=""http://twitter.com/download/android"" rel=""nofollow"">Twitter for Android</a>",retweet,244863983738294274,2.4486398373829427e+17,,0,4,0,Hokies,http://youtu.be/w8DNR-rWKyE,http://youtu.be/w8DNR-rWKyE,kevinwalke,96067789,15679679|813286,17,4,0,Fri Dec 11 05:49:17 +0000 2009,0,False,89,https://www.youtube.com/watch?v=w8DNR-rWKyE&feature=youtu.be,john boyer & his world regions class at virginia tech request president barack obama to visit - youtube,professor john boyer and his 3000 person world regions class at virginia tech request president barack obama to come to his class and discuss american foreig,www.youtube.com,rtcsread61its awesome barack obama go john boxer amp world regions class virginia tech request president john boxer world regions class virginia tech request president barack obama visit youtube professor john boxer three thousand person world regions class virginia tech request president barack obama come class discuss american big
61,702,244908413866352640,2012-09-09 21:21:30,This is how to hug http://t.co/fUpcmsty,web,tweet,244908413866352640,,,0,0,0,,http://gawker.com/5941727/this-is-a-photo-of-the-president-being-lifted-in-the-air-by-a-powerful-hug,http://gawker.com/5941727/this-is-a-photo-of-the-president-being-lifted-in-the-air-by-a-powerful-hug,BrockworthBajr,395263528,,199,146,2,Fri Oct 21 11:55:02 +0000 2011,0,False,7343,https://gawker.com/5941727/this-is-a-photo-of-the-president-being-lifted-in-the-air-by-a-powerful-hug,this is a photo of the president being lifted in the air by a powerful hug (updated),doug mills of the new york times tweeted this photo of barack obama getting lifted in the air by big apple pizza owner (and bear hug enthusiast) scott van duzer,gawker.com,hug photo president lifted air powerful hug updated doug mills new york times tweet ed photo barack obama getting lifted air big apple pizza owner bear hug enthusiast scott van user
62,703,244908414147371008,2012-09-09 21:21:30,A biker on @SwannyDPM s lap? I dont think so. Great photos from US via @leighsales @buzzfeedandrew http://t.co/MgcYTV4H,"<a href=""http://twitter.com/download/iphone"" rel=""nofollow"">Twitter for iPhone</a>",tweet,244908414147371008,,,0,0,0,,http://www.buzzfeed.com/andrewkaczynski/air-obama-pizza-shop-owner-gives-president-a-big,http://www.buzzfeed.com/andrewkaczynski/air-obama-pizza-shop-owner-gives-president-a-big,JenBrockie,478068056,267570919|26607837|326255267,4712,614,82,Sun Jan 29 21:36:22 +0000 2012,0,False,3068,https://www.buzzfeednews.com/article/andrewkaczynski/air-obama-pizza-shop-owner-gives-president-a-big,pizza shop owner gives president a big hug,scott van duzer owner of the big apple pizza showed his affection for the president today in florida,www.buzzfeednews.com,biker sandy pm slap think great photos us via leigh sales buzz feed andrew pizza shop owner gives president big hug scott van user owner big apple pizza showed affection president today florida
63,709,244908423265779712,2012-09-09 21:21:32,RT @kgosztola: Americas refusal to extradite Bolivias ex-president to face genocide charges http://t.co/AWZ1dcki by @ggreenwald,"<a href=""http://blackberry.com/twitter"" rel=""nofollow"">Twitter for BlackBerry®</a>",retweet,244907902031241216,2.449079020312412e+17,,0,4,0,,http://bit.ly/Pfoy3W|http://bit.ly/Pfoy3W,http://bit.ly/Pfoy3W,subverzo,18350235,15808218|16076032,3010,3098,126,Wed Dec 24 04:01:05 +0000 2008,0,False,30248,https://www.theguardian.com/commentisfree/2012/sep/09/america-refusal-extradite-bolivia,americas refusal to extradite bolivias ex-president to face genocide charges  bolivia  the guardian,glenn greenwald: obama justice officials have all but granted asylum to snchez de lozada  a puppet who payrolled key democratic advisers,www.theguardian.com,rt go sz la americas refusal extradited bolivia sex president face genocide charges g greenwald americas refusal extradited bolivia sex president face genocide charges bolivia guardian glenn greenwald obama justice officials granted asylum sn chez de load puppet pay rolled key democratic advisers
64,714,244908431859908608,2012-09-09 21:21:34,RT @mrbenjaminlaw: Well this Republican loves Obama so bad he lifts him off the floor in a bear hug. Rad photo.  http://t.co/8OHMmTGl  ...,"<a href=""http://twitter.com/download/iphone"" rel=""nofollow"">Twitter for iPhone</a>",retweet,244903973495128065,2.4490397349512806e+17,,0,1,0,,http://www.buzzfeed.com/andrewkaczynski/air-obama-pizza-shop-owner-gives-president-a-big|http://www.buzzfeed.com/andrewkaczynski/air-obama-pizza-shop-owner-gives-president-a-big,http://www.buzzfeed.com/andrewkaczynski/air-obama-pizza-shop-owner-gives-president-a-big,alicia_wood,15900849,41088384|26607837,1599,522,61,Tue Aug 19 05:01:06 +0000 2008,0,False,3318,https://www.buzzfeednews.com/article/andrewkaczynski/air-obama-pizza-shop-owner-gives-president-a-big,pizza shop owner gives president a big hug,scott van duzer owner of the big apple pizza showed his affection for the president today in florida,www.buzzfeednews.com,rt mr benjamin law well republican loves obama bad lifts floor bear hu grad photo pizza shop owner gives president big hug scott van user owner big apple pizza showed affection president today florida
65,725,244908444358950912,2012-09-09 21:21:37,RT @wld1: The Van Duzer Foundation is well-represented by Scott Van Duzer - Obama Gets a Lift on the Trail http://t.co/bhMlK4NC,web,retweet,244907517363253248,2.4490751736325325e+17,,0,1,0,,http://nyti.ms/QxoFHD|http://nyti.ms/QxoFHD,http://nyti.ms/QxoFHD,art2u2,47677431,33110127,2411,1809,181,Tue Jun 16 17:06:33 +0000 2009,0,False,61057,https://thecaucus.blogs.nytimes.com/2012/09/09/obama-gets-a-lift-on-the-trail/?smid=tw-share,obama gets a lift on the trail - the new york times,an republican obama supporter throws his muscle around with the president,thecaucus.blogs.nytimes.com,told1thevanduzer foundation well represented scott van user obama gets lift trail obama gets lift trail new york times republican obama supporter throws muscle around president
66,750,244908489820999681,2012-09-09 21:21:48,Garoto de 5 anos vira prodgio da sinuca e usa at irmozinho para fazer truques assista http://t.co/0vIyalED via @UOLEsporte,"<a href=""http://twitter.com/tweetbutton"" rel=""nofollow"">Tweet Button</a>",tweet,244908489820999681,,,0,0,0,,http://uolesporte.blogosfera.uol.com.br/2012/09/09/garoto-de-5-anos-vira-prodigio-da-sinuca-e-usa-ate-irmaozinho-para-fazer-truques-assista/,http://uolesporte.blogosfera.uol.com.br/2012/09/09/garoto-de-5-anos-vira-prodigio-da-sinuca-e-usa-ate-irmaozinho-para-fazer-truques-assista/,Bedranzinho,73874157,14595245,14,35,0,Sun Sep 13 12:33:56 +0000 2009,0,False,272,https://uolesporte.blogosfera.uol.com.br/2012/09/09/garoto-de-5-anos-vira-prodigio-da-sinuca-e-usa-ate-irmaozinho-para-fazer-truques-assista/,garoto de 5 anos vira prodgio da sinuca e usa at irmozinho para fazer truques assista - uol esporte,veja resultados notcias entrevistas fotos vdeos e os bastidores do esporte acompanhe ao vivo os principais eventos esportivos no brasil e do mundo,uolesporte.blogosfera.uol.com.br,proto de5anosviraprodgiodasinu caeusaatirmozinhoparafaz ertruquesassistaviauole sport egarotode5anosviraprodgi odasinucaeusaatirmozinho para after tru ques assist url esporte veja resultados cias entrevista fotos videos eos last does porte company head vivo os principals eventos e sportive no brasil mundo
67,759,244908501510529026,2012-09-09 21:21:51,RT @eportlow: Oops Did I Say Something Else Befor?: Romney says he wont cut taxes on wealthy Americans   http://t.co/JEZhqbMs via @Y ...,"<a href=""http://twitter.com/download/android"" rel=""nofollow"">Twitter for Android</a>",retweet,244901009170776066,2.4490100917077606e+17,,0,2,0,,http://news.yahoo.com/blogs/ticket/romney-says-won-t-cut-taxes-wealthy-americans-144438996--election.html|http://news.yahoo.com/blogs/ticket/romney-says-won-t-cut-taxes-wealthy-americans-144438996--election.html,http://news.yahoo.com/blogs/ticket/romney-says-won-t-cut-taxes-wealthy-americans-144438996--election.html,ChuckNaven,467364536,366696485|7309052,199,226,6,Wed Jan 18 11:42:58 +0000 2012,0,False,7065,https://news.yahoo.com/blogs/ticket/romney-says-won-t-cut-taxes-wealthy-americans-144438996--election.html,romney says he wont cut taxes on wealthy americans,mitt romney rejected claims by president barack obama that he would sign off on more tax breaks for the wealthy if elected president but again declined to offer specifics on how exactly he would accomplish his goal of lowering taxes for other americans while also balancing the budget in an interview with nbcs meet the [],news.yahoo.com,rte port low oops say something else romney says cut taxes wealthy americans via romney says cut taxes wealthy americans mitt romney rejected claims president barack obama would sign tax breaks wealthy elected president declined offer specifics exactly would accomplish goal lowering taxes americans also balancing budget interview nbc meet
68,774,244908530304442369,2012-09-09 21:21:58,Barack #Obama bromea en #Florida sobre el tema de su certificado de nacimiento. http://t.co/7l80AadT,"<a href=""http://twitter.com/download/iphone"" rel=""nofollow"">Twitter for iPhone</a>",tweet,244908530304442369,,,0,0,0,Obama|Florida,http://bit.ly/PfG206,http://bit.ly/PfG206,RogerMatthei,544964877,,925,1977,1,Wed Apr 04 06:03:00 +0000 2012,0,False,4229,https://cnnespanol.cnn.com/2012/09/09/obama-le-pregunta-a-un-nino-hawaiano-tienes-un-certificado-de-nacimiento/,obama le pregunta a un nio hawaiano: tienes un certificado de nacimiento?  cnn,(cnn) qu hace el presidente de estados unidos barack obama cuando se encuentra con otra persona nacida en hawi? le pide su certificado de nacimiento  estados unidos  cnn,cnnespanol.cnn.com,barack obama broke en florida sobre el tema de su certificate de nacimiento obama le presenta aunniohawaianotienesun certificate de nacimiento cnncnnquhaceel presidente de estados undo barack obama undo se encuesta co r person anacidaenhawilepidesu certificate de nacimiento estados undo cnn
69,778,244908539510935553,2012-09-09 21:22:00,Leslie could impact NE USA @NHC_Atlantic Tropical Storm #Leslie moving slowly past bermuda  http://t.co/e2jAyCpm,"<a href=""http://twitter.com/download/iphone"" rel=""nofollow"">Twitter for iPhone</a>",tweet,244908539510935553,,,0,0,0,Leslie,http://go.usa.gov/W3H,http://go.usa.gov/W3H,PatParag,156067653,299798272,11,117,0,Tue Jun 15 23:06:28 +0000 2010,0,False,1220,https://www.nhc.noaa.gov/cyclones/,nhc active tropical cyclones,,www.nhc.noaa.gov,leslie could impact ne usa nh atlantic tropical storm leslie moving slowly past bermuda nh active tropical cyclone
70,779,244908539276054528,2012-09-09 21:22:00,RT @d_seaman: This is one of the most important videos on YouTube: http://t.co/zfr5voQT - Obama trying to defend #NDAA imprisonment with ...,"<a href=""http://twitter.com/download/iphone"" rel=""nofollow"">Twitter for iPhone</a>",retweet,244898029927268352,2.4489802992726835e+17,,0,27,0,NDAA,http://www.youtube.com/watch?v=ceobsac7LE8|http://www.youtube.com/watch?v=ceobsac7LE8,http://www.youtube.com/watch?v=ceobsac7LE8,Andy_Marg,441334301,438829074,21,113,0,Tue Dec 20 00:18:55 +0000 2011,0,False,479,https://www.youtube.com/watch?v=ceobsac7LE8,ben swann interviews president obama (ndaa kill list syria afghanistan) - youtube,click to tweet: http://clicktotweetcom/cjim6 ben swann of fox19 interviews president barack obama on ndaa indefinite detention the presidential kill list,www.youtube.com,red seaman one important videos youtube obama trying defend ncaa imprisonment ben swan interviews president ob amanda kill list syria afghanistan youtube click tweetbenswannoffox19 interviews president barack obama ncaa indefinite detention presidential kill list
71,782,244908540458827776,2012-09-09 21:22:00,@sugarscape: Demi Lovato spat on Simon Cowell during X Factor USA audition. LOVELY. http://t.co/z35rE0zg @NiallOfficial,"<a href=""http://twitter.com/download/iphone"" rel=""nofollow"">Twitter for iPhone</a>",tweet,244908540458827776,,,0,0,0,,http://on.sugarsca.pe/TEkoDJ,http://on.sugarsca.pe/TEkoDJ,Caitlyn_Mari333,616505332,16510838|105119490,186,361,0,Sat Jun 23 21:42:53 +0000 2012,0,False,3984,https://www.cosmopolitan.com/uk/,cosmopolitan uk the womens magazine for fashion beauty sex tips and celebrity news,,www.cosmopolitan.com,sugars cape demi lovato spat simon powell factor usa audition lovely small official cosmopolitan uk womens magazine fashion beauty sex tips celebrity news
72,784,244908545529761792,2012-09-09 21:22:02,@sugarscape: Demi Lovato spat on Simon Cowell during X Factor USA audition. LOVELY. http://t.co/Yjybwmgg I like demo lovato,"<a href=""http://twitter.com/download/iphone"" rel=""nofollow"">Twitter for iPhone</a>",tweet,244908545529761792,,,0,0,0,,http://on.sugarsca.pe/TEkoDJ,http://on.sugarsca.pe/TEkoDJ,Arden_Stylinson,342916254,16510838,180,203,0,Tue Jul 26 19:45:05 +0000 2011,0,False,11385,https://www.cosmopolitan.com/uk/,cosmopolitan uk the womens magazine for fashion beauty sex tips and celebrity news,,www.cosmopolitan.com,sugars cape demi lovato spat simon powell factor usa audition lovely like demo lovato cosmopolitan uk womens magazine fashion beauty sex tips celebrity news
73,787,244908547241041920,2012-09-09 21:22:02,RT @sugarscape: Demi Lovato spat on Simon Cowell during X Factor USA audition. LOVELY. http://t.co/rX7LgDbk,"<a href=""http://twitter.com/download/iphone"" rel=""nofollow"">Twitter for iPhone</a>",retweet,244907173216407553,2.4490717321640755e+17,,0,19,0,,http://on.sugarsca.pe/TEkoDJ|http://on.sugarsca.pe/TEkoDJ,http://on.sugarsca.pe/TEkoDJ,Caitlyn_Mari333,616505332,16510838,186,361,0,Sat Jun 23 21:42:53 +0000 2012,0,False,3985,https://www.cosmopolitan.com/uk/,cosmopolitan uk the womens magazine for fashion beauty sex tips and celebrity news,,www.cosmopolitan.com,rt sugars cape demi lovato spat simon powell factor usa audition lovely cosmopolitan uk womens magazine fashion beauty sex tips celebrity news
74,796,244908554551717891,2012-09-09 21:22:04,RT @sugarscape: Demi Lovato spat on Simon Cowell during X Factor USA audition. LOVELY. http://t.co/rX7LgDbk,"<a href=""http://twitter.com/download/iphone"" rel=""nofollow"">Twitter for iPhone</a>",retweet,244907173216407553,2.4490717321640755e+17,,0,20,0,,http://on.sugarsca.pe/TEkoDJ|http://on.sugarsca.pe/TEkoDJ,http://on.sugarsca.pe/TEkoDJ,Arden_Stylinson,342916254,16510838,180,203,0,Tue Jul 26 19:45:05 +0000 2011,0,False,11386,https://www.cosmopolitan.com/uk/,cosmopolitan uk the womens magazine for fashion beauty sex tips and celebrity news,,www.cosmopolitan.com,rt sugars cape demi lovato spat simon powell factor usa audition lovely cosmopolitan uk womens magazine fashion beauty sex tips celebrity news
75,822,244908590425595904,2012-09-09 21:22:12,RT @JenBrockie: A biker on @SwannyDPM s lap? I dont think so. Great photos from US via @leighsales @buzzfeedandrew http://t.co/MgcYTV4H,"<a href=""http://twitter.com/download/iphone"" rel=""nofollow"">Twitter for iPhone</a>",retweet,244908414147371008,2.44908414147371e+17,,0,1,0,,http://www.buzzfeed.com/andrewkaczynski/air-obama-pizza-shop-owner-gives-president-a-big|http://www.buzzfeed.com/andrewkaczynski/air-obama-pizza-shop-owner-gives-president-a-big,http://www.buzzfeed.com/andrewkaczynski/air-obama-pizza-shop-owner-gives-president-a-big,Orange_salt,350154273,478068056|267570919|26607837|326255267,508,970,9,Sun Aug 07 08:51:02 +0000 2011,0,False,14428,https://www.buzzfeednews.com/article/andrewkaczynski/air-obama-pizza-shop-owner-gives-president-a-big,pizza shop owner gives president a big hug,scott van duzer owner of the big apple pizza showed his affection for the president today in florida,www.buzzfeednews.com,rt jen broke biker sandy pm slap think great photos us via leigh sales buzz feed andrew pizza shop owner gives president big hug scott van user owner big apple pizza showed affection president today florida
76,830,244908602962370561,2012-09-09 21:22:15,RT @sugarscape: Demi Lovato spat on Simon Cowell during X Factor USA audition. LOVELY. http://t.co/rX7LgDbk,"<a href=""http://mobile.twitter.com"" rel=""nofollow"">Mobile Web</a>",retweet,244907173216407553,2.4490717321640755e+17,,0,21,0,,http://on.sugarsca.pe/TEkoDJ|http://on.sugarsca.pe/TEkoDJ,http://on.sugarsca.pe/TEkoDJ,RonBeastly10,138310993,16510838,105,187,0,Thu Apr 29 05:41:30 +0000 2010,0,False,10920,https://www.cosmopolitan.com/uk/,cosmopolitan uk the womens magazine for fashion beauty sex tips and celebrity news,,www.cosmopolitan.com,rt sugars cape demi lovato spat simon powell factor usa audition lovely cosmopolitan uk womens magazine fashion beauty sex tips celebrity news
77,837,244908612818984960,2012-09-09 21:22:18,RT @blogolhar21: #BOMBA RUSSOMANO faz sua ONG de COMIT ELEITORAL: http://t.co/BsaoaUPz #Eleicoes2012 #OTwitterDeveria,"<a href=""http://www.tweetdeck.com"" rel=""nofollow"">TweetDeck</a>",tweet,244908612818984960,,,0,0,0,BOMBA|Eleicoes2012|OTwitterDeveria,http://blogdoparrini.blogspot.com/2012/09/bomba-russomano-usa-sua-ong-para.html?spref=tw,http://blogdoparrini.blogspot.com/2012/09/bomba-russomano-usa-sua-ong-para.html?spref=tw,Parrinix1,479977622,715993778,2868,2918,14,Wed Feb 01 00:17:01 +0000 2012,0,False,883,http://blogdoparrini.blogspot.com/2012/09/bomba-russomano-usa-sua-ong-para.html?spref=tw,#acordabrasil: #bomba russomano usa sua ong para campanha eleitoral,as vezes chegamos at a sermos chatos criticando certos candidatos mas isto se faz necessrio quando sabemos que o cara  um criminoso f,blogdoparrini.blogspot.com,rtblogolhar21bombarussom anofazsuaongdecomiteleit oral eleicoes2012otwitterdeve riaa cord brasil bomb russo mano usasuaongparacampanhaele oral asvezeschegamosatasermos chat os critic one ros candidates masistosefaznecessrioqu osabemosqueocaraumcri minor
